key,fr,en
DIALOG_MONKEY_CAMPAIGN_1,Que fait une bande de singes sur notre planète.,"Monkeys are not welcome here, prepare to die."
DIALOG_MONKEY_CAMPAIGN_1_2,"Bon, pas le choix il va falloir se battre.",Looks like we are already in trouble.
DIALOG_MONKEY_CAMPAIGN_2,Nous sommes bientôt arrivé à Urskull.,We have almost arrived at Urskull.
DIALOG_MONKEY_CAMPAIGN_2_2,Vous là-bas. Vous êtes qui ?,Hey you. Who are you ?
DIALOG_MONKEY_CAMPAIGN_2_3,Nous venons proposer une alliance en vue de la guerre contre les chauves-souris,We are here to negociate an alliance to your king to fight against bats.
DIALOG_MONKEY_CAMPAIGN_2_4,J’en ai rien à foutre de ta guerre. Donne juste tes pièces.,I don’t care. Juste give me your money.
DIALOG_MONKEY_CAMPAIGN_2_5,"Bon..  Encore un brigand, le roi me remerciera de ton élimination au moins.","Well.. Another brigand, the king will thank me for your elimination."
DIALOG_MONKEY_CAMPAIGN_2_WIN,J’espère qu’on est bientôt arrivé. J’en ai marre de tout ces bandits.,I hope Urskville is near. I'm kind of annoy with all these bandits.
